id,content,comments,keywords,tendency,views,date,primary_category,secondary_category
978271,"냉장 물류 작업에 적응하는 데 어려움을 겪고 있습니다. 여러 도전적인 상황 속에서도 열심히 일하고 있으며, 주변의 많은 변화에 적응 중입니다.",젊을 때 바쁘게 사는 것이 좋습니다. 힘내세요.,냉장 물류; 적응; 근무 환경,경험성,337,2025-01-30 16:18,근무 환경 및 조건,노동 및 고용 관련 이슈
978270,카페 아르바이트에서 3.3% 공제를 확인할 수 있는 방법이 궁금합니다. 근로계약서 작성이 지연되고 있으며 급여도 밀리고 있습니다.,홈택스에서 사업소득원천징수내역을 확인할 수 있습니다. 근로명세서를 요청하세요.,카페 아르바이트; 3.3% 공제; 근로계약서,질문성,348,2025-01-30 16:08,업종별 아르바이트,고용 형태 및 계약
978269,김포컬리에서 설날 급여가 언제 들어오는지 궁금합니다.,동의합니다.,김포컬리; 설날 급여; 급여 일정,질문성,155,2025-01-30 16:03,급여 및 보상 관련,근무 환경 및 조건
978268,쿠팡 동탄1 센터에서 입출고 작업 시 안전화를 착용해야 하는지 궁금합니다.,모든 센터에서 안전화를 착용합니다.; 계약직 여부에 따라 다를 수 있습니다.,쿠팡; 안전화; 입출고 작업,질문성,198,2025-01-30 15:50,업종별 아르바이트,근무 환경 및 조건
978267,무신사 매장의 점장도 알바몬으로 채용하는지 궁금합니다. 점장의 행동이 신세계 그룹 임직원처럼 느껴졌습니다.,알바몬 등에서 매장 직원을 구하는 경우가 많습니다. 점장도 관리자로서의 역할이 중요합니다.,무신사; 점장 채용; 알바몬,경험성,212,2025-01-30 15:50,취업 및 채용 관련,업종별 아르바이트